[
  {
    "item_id": "f2b3c4d5e6a70819304b5c6d7e8f9a0b1c2d3e4f5a6b7c8d9e0f1a2b3c4d5e6",
    "topic_slug": "finance",
    "secondary_topics": ["economy"],
    "headline": "Fed minutes reveal no urgency to cut rates in Q1 2025",
    "summary_text": "Minutes from the December FOMC meeting published on January 15 showed officials broadly agreed that there was no reason to lower the federal funds rate until inflation data showed sustained progress toward the 2% target.",
    "source_url": "https://example.com/finance/fed-minutes",
    "source_name": "MarketWatch",
    "source_type": "rss",
    "source_domain": "example.com",
    "supporting_sources": null,
    "severity_score": 70,
    "importance_score": 90,
    "confidence_score": 95,
    "send_alert": true,
    "alert_reason": "FOMC minutes directly influencing rate expectations is a high-importance event for finance audiences.",
    "event_at": "2025-01-15T19:00:00Z",
    "cluster_label": "Fed Rate Decision"
  },
  {
    "item_id": "a1b2c3d4e5f60718293b5c6d7e8f9a0b1c2d3e4f5a6b7c8d9e0f1a2b3c4d5e6",
    "topic_slug": "finance",
    "secondary_topics": [],
    "headline": "S&P 500 falls 1.2% as rate-cut hopes fade",
    "summary_text": "US equities declined sharply after the Fed minutes were released, with the S&P 500 closing 1.2% lower and rate-sensitive sectors such as real estate and utilities leading losses.",
    "source_url": "https://example.com/finance/sp500-decline",
    "source_name": "Bloomberg",
    "source_type": "api",
    "source_domain": "example.com",
    "supporting_sources": null,
    "severity_score": 65,
    "importance_score": 80,
    "confidence_score": 92,
    "send_alert": true,
    "alert_reason": "A 1.2% index decline driven by a clear macro catalyst is alert-worthy for the finance audience.",
    "event_at": "2025-01-15T21:00:00Z",
    "cluster_label": "Fed Rate Decision"
  },
  {
    "item_id": "b2c3d4e5f6a70819304c5c6d7e8f9a0b1c2d3e4f5a6b7c8d9e0f1a2b3c4d5e6",
    "topic_slug": "finance",
    "secondary_topics": [],
    "headline": "US dollar index hits two-month high after Fed signal",
    "summary_text": "The DXY dollar index climbed to its highest level in two months as traders repriced rate expectations, with EUR/USD briefly dipping below 1.09.",
    "source_url": "https://example.com/finance/dxy-two-month-high",
    "source_name": "Reuters",
    "source_type": "rss",
    "source_domain": "example.com",
    "supporting_sources": null,
    "severity_score": 55,
    "importance_score": 72,
    "confidence_score": 88,
    "send_alert": false,
    "alert_reason": "Currency move is notable but secondary to the equity and rate story already alerted.",
    "event_at": "2025-01-15T20:10:00Z",
    "cluster_label": "Fed Rate Decision"
  }
]
