[
  {
    "item_id": "c1a2b3d4e5f60718293a4b5c6d7e8f9a0b1c2d3e4f5a6b7c8d9e0f1a2b3c4d5",
    "topic_slug": "crypto",
    "secondary_topics": ["finance"],
    "headline": "Spot Bitcoin ETFs record $500M inflows in a single session",
    "summary_text": "US-listed spot Bitcoin ETFs attracted more than $500 million in net inflows on January 15, the largest single-day figure since the products launched, according to multiple tracking services.",
    "source_url": "https://example.com/crypto/btc-etf-inflows",
    "source_name": "CryptoNews",
    "source_type": "rss",
    "source_domain": "example.com",
    "supporting_sources": [
      {
        "source_name": "CoinGecko API",
        "source_url": "https://api.coingecko.com/api/v3/simple/price",
        "source_type": "api",
        "source_role": "data"
      }
    ],
    "severity_score": 60,
    "importance_score": 82,
    "confidence_score": 90,
    "send_alert": true,
    "alert_reason": "Record-setting ETF inflow day is a significant milestone for institutional crypto adoption.",
    "event_at": "2025-01-15T14:30:00Z",
    "cluster_label": "Bitcoin ETF Inflows"
  },
  {
    "item_id": "d2e3f4a5b6c70819304b5c6d7e8f9a0b1c2d3e4f5a6b7c8d9e0f1a2b3c4d5e6",
    "topic_slug": "crypto",
    "secondary_topics": [],
    "headline": "Bitcoin price crosses $50,000 briefly on ETF demand",
    "summary_text": "Bitcoin touched $50,000 briefly during the Asian session before pulling back to $49,400. Analysts attributed the move to anticipation of continued institutional inflows via spot ETF products.",
    "source_url": "https://example.com/crypto/btc-50k",
    "source_name": "BlockDesk",
    "source_type": "rss",
    "source_domain": "example.com",
    "supporting_sources": null,
    "severity_score": 50,
    "importance_score": 74,
    "confidence_score": 88,
    "send_alert": true,
    "alert_reason": "Price crossing a key psychological level warrants an alert to the crypto audience.",
    "event_at": "2025-01-15T07:15:00Z",
    "cluster_label": "Bitcoin ETF Inflows"
  },
  {
    "item_id": "e3f4a5b6c7d80920415b5c6d7e8f9a0b1c2d3e4f5a6b7c8d9e0f1a2b3c4d5e6",
    "topic_slug": "crypto",
    "secondary_topics": [],
    "headline": "Ethereum ETF products see parallel inflow surge",
    "summary_text": "Ethereum spot ETFs mirrored Bitcoin ETF activity, recording their second-highest day of inflows since approval, suggesting broad institutional appetite for crypto exposure.",
    "source_url": "https://example.com/crypto/eth-etf-inflows",
    "source_name": "CoinWire",
    "source_type": "rss",
    "source_domain": "example.com",
    "supporting_sources": null,
    "severity_score": 40,
    "importance_score": 68,
    "confidence_score": 85,
    "send_alert": false,
    "alert_reason": "Notable but below threshold; covered by the broader ETF inflow narrative.",
    "event_at": "2025-01-15T16:45:00Z",
    "cluster_label": "Bitcoin ETF Inflows"
  }
]
